{
  "text": "eu preciso de terminar de fazer a minha tabela, está muito foda **",
  "in_reply_to_status_id": null,
  "retweet_count": null,
  "contributors": null,
  "created_at": "Thu Sep 02 18:11:23 +0000 2010",
  "geo": null,
  "source": "web",
  "coordinates": null,
  "in_reply_to_screen_name": null,
  "truncated": false,
  "entities": {
    "user_mentions": [],
    "urls": [],
    "hashtags": []
  },
  "retweeted": false,
  "place": null,
  "user": {
    "friends_count": 73,
    "profile_sidebar_fill_color": "768575",
    "location": "",
    "verified": false,
    "follow_request_sent": null,
    "favourites_count": 1,
    "profile_sidebar_border_color": "1c9dbd",
    "profile_image_url": "http://a2.twimg.com/profile_images/1036412454/OgAAADXK9q6kaxrvfwQTINH66RVLAH9YHb-veRTA4FaWb9KtbGGV_yKTGzmvzTfJidqAb5gK_mpspIE-MIvAASGH2CwAm1T1UIPQk0-HS8x_TV5kdnW30nch7ODk-1_normal.jpg",
    "geo_enabled": false,
    "created_at": "Fri Jul 03 21:44:05 +0000 2009",
    "description": "só os loucos sabem (:",
    "time_zone": "Brasilia",
    "url": "http://http://www.orkut.com.br/Main#Profile?uid=1433295880233078770",
    "screen_name": "Bia_cunha1",
    "notifications": null,
    "profile_background_color": "081114",
    "listed_count": 0,
    "lang": "en",
    "profile_background_image_url": "http://a1.twimg.com/profile_background_images/133178546/biatwitter.jpg",
    "statuses_count": 3504,
    "following": null,
    "profile_text_color": "25b8c2",
    "protected": false,
    "show_all_inline_media": false,
    "profile_background_tile": true,
    "name": "Beatriz Helena Cunha",
    "contributors_enabled": false,
    "profile_link_color": "eb55b6",
    "followers_count": 102,
    "id": 53507833,
    "profile_use_background_image": true,
    "utc_offset": -10800
  },
  "favorited": false,
  "in_reply_to_user_id": null,
  "id": 22819396900
}
